;;001;212;32101;63200;2014/000038;2014/000038;OBRAS CONSERVACIÓN COLEGIOS Y OTROS CENTROS EDUCATIVOS DISTRITO USERA;212;USERA;05;EDUCACIÓN;00;COLEGIOS;;;;;;;444.186,00;-444.147,00;39,00;39,00;0,00;0,00;0,00;0,00;0,00;0,00
;;001;212;32101;63200;2014/000038;2014/010038;COLEGIO PÚBLICO REPÚBLICA DE VENEZUELA, C/ CERECINOS, 8. OBRAS DE CONSERVACIÓN;212;USERA;05;EDUCACIÓN;00;COLEGIOS;;;;;;;0,00;36.731,30;36.731,30;0,00;0,00;36.731,30;36.731,30;36.731,30;0,00;7.931,91
;;001;212;32101;63200;2014/000038;2014/020038;COLEGIO PÚBLICO GLORIA FUERTES, C/ CENSO, 3. OBRAS DE CONSERVACIÓN;212;USERA;05;EDUCACIÓN;00;COLEGIOS;;;;;;;0,00;12.708,34;12.708,34;0,00;0,00;12.708,34;12.708,34;12.708,34;0,00;12.708,34
;;001;212;32101;63200;2014/000038;2014/030038;COLEGIO PÚBLICO JUAN SEBASTIÁN ELCANO, C/ MIRASIERRA, 29. OBRAS DE CONSERVACIÓN;212;USERA;05;EDUCACIÓN;00;COLEGIOS;;;;;;;0,00;34.844,60;34.844,60;0,00;0,00;34.844,60;34.844,60;34.844,60;0,00;34.844,60
;;001;212;32101;63200;2014/000038;2014/040038;COLEGIO PÚBLICO MESETA DE ORCASITAS. OBRAS DE CONSERVACIÓN;212;USERA;05;EDUCACIÓN;00;COLEGIOS;;;;;;;0,00;35.344,62;35.344,62;0,00;0,00;35.344,62;35.344,62;35.344,62;0,00;35.344,62
;;001;212;32101;63200;2014/000038;2014/050038;COLEGIO PÚBLICO PRADOLONGO. OBRAS DE CONSERVACIÓN.;212;USERA;05;EDUCACIÓN;00;COLEGIOS;;;;;;;0,00;17.214,75;17.214,75;0,00;0,00;17.214,75;17.214,75;17.214,75;0,00;17.214,75
;;001;212;32101;63200;2014/000038;2014/060038;COLEGIO PÚBLICO PUERTO RICO. OBRAS DE ACONDICIONAMIENTO;212;USERA;05;EDUCACIÓN;00;COLEGIOS;;;;;;;0,00;47.362,17;47.362,17;0,00;0,00;47.362,17;47.362,17;47.362,17;0,00;47.362,17
;;001;212;32101;63200;2014/000038;2014/070038;COLEGIO PÚBLICO REPÚBLICA DEL BRASIL. OBRAS DE ACONDICIONAMIENTO;212;USERA;05;EDUCACIÓN;00;COLEGIOS;;;;;;;0,00;55.662,42;55.662,42;0,00;0,00;55.662,42;55.662,42;55.662,42;0,00;55.662,42
;;001;212;32101;63200;2014/000038;2014/080038;CENTRO DE EDUCACIÓN ESPECIAL JOAN MIRÓ. OBRAS DE CONSERVACIÓN;212;USERA;05;EDUCACIÓN;02;CENTROS DE EDUCACIÓN ESPECIAL;;;;;;;0,00;18.489,48;18.489,48;0,00;0,00;18.489,48;18.489,48;18.489,48;0,00;18.489,48
;;001;212;32101;63200;2014/000038;2014/090038;COLEGIO PÚBLICO MARCELO USERA. OBRAS DE CONSERVACIÓN;212;USERA;05;EDUCACIÓN;00;COLEGIOS;;;;;;;0,00;23.709,45;23.709,45;0,00;0,00;23.709,45;23.709,45;23.709,45;0,00;23.709,45
;;001;212;32101;63200;2014/000038;2014/100038;COLEGIO PÚBLICO JORGE MANRIQUE. OBRAS DE CONSERVACIÓN;212;USERA;05;EDUCACIÓN;00;COLEGIOS;;;;;;;0,00;16.973,20;16.973,20;0,00;0,00;16.973,20;16.973,20;16.973,20;0,00;16.973,20
;;001;212;32101;63200;2014/000038;2014/110038;COLEGIO PÚBLICO NUESTRA SEÑORA DE LA FUENCISLA. OBRAS DE ACONDICIONAMIENTO;212;USERA;05;EDUCACIÓN;00;COLEGIOS;;;;;;;0,00;29.944,63;29.944,63;0,00;0,00;29.944,63;29.944,63;29.944,63;0,00;29.944,63
;;001;212;32101;63200;2014/000038;2014/120038;COLEGIO PÚBLICO CIUDAD DE JAEN. OBRAS DE REFORMA;212;USERA;05;EDUCACIÓN;00;COLEGIOS;;;;;;;0,00;44.575,92;44.575,92;0,00;0,00;44.575,92;44.575,92;44.575,92;0,00;44.575,92
;;001;212;32101;63200;2014/000038;2014/130038;ESCUELA DE MÚSICA MAESTRO BARBIERI, C/ CESTONA, 3. OBRAS DE CONSERVACIÓN;212;USERA;05;EDUCACIÓN;03;ESCUELAS DE MÚSICA;;;;;;;0,00;41.110,99;41.110,99;0,00;0,00;41.110,99;41.110,99;41.110,99;0,00;0,00
;;001;212;32101;63200;2014/000038;2014/140038;ESCUELA INFANTIL LA CORNISA, C/ CRISTO DE LA VICTORIA, 23. OBRAS DE REFORMA;212;USERA;05;EDUCACIÓN;01;ESCUELAS INFANTILES;;;;;;;0,00;29.475,13;29.475,13;0,00;0,00;29.475,13;29.475,13;29.475,13;0,00;0,00
;;001;213;32101;63200;2014/000041;2014/100041;COLEGIO PÚBLICO DOCTOR TOLOSA LATOUR, C/ ASTURIANOS, 4. OBRAS DE CONSERVACIÓN;213;PUENTE DE VALLECAS;05;EDUCACIÓN;00;COLEGIOS;;;;;;;0,00;27.329,31;27.329,31;0,00;0,00;27.329,31;27.329,31;27.329,31;0,00;27.329,31
;;001;213;32101;63200;2014/000041;2014/110041;COLEGIO PÚBLICO FRAY JUNÍPERO SERRA, C/ ALMONACID, 16. OBRAS DE CONSERVACIÓN;213;PUENTE DE VALLECAS;05;EDUCACIÓN;00;COLEGIOS;;;;;;;0,00;14.893,33;14.893,33;0,00;0,00;14.893,33;14.893,33;14.893,33;0,00;14.893,33
;;001;213;32101;63200;2014/000041;2014/120041;COLEGIO PÚBLICO JAIME BALMÉS, C/ SIERRA SOLANA, 2. OBRAS DE CONSERVACIÓN;213;PUENTE DE VALLECAS;05;EDUCACIÓN;00;COLEGIOS;;;;;;;0,00;30.910,03;30.910,03;0,00;0,00;30.910,03;30.910,03;30.910,03;0,00;30.910,03
;;001;213;32101;63200;2014/000041;2014/130041;COLEGIO PÚBLICO LA RIOJA, C/ LEÓN FELIPE, 3. OBRAS DE ACONDICIONAMIENTO;213;PUENTE DE VALLECAS;05;EDUCACIÓN;00;COLEGIOS;;;;;;;0,00;32.005,61;32.005,61;0,00;0,00;32.005,61;32.005,61;32.005,61;0,00;32.005,61
;;001;213;32101;63200;2014/000041;2014/140041;COLEGIO PÚBLICO PADRE MARIANA, C/ RONDA DEL SUR, 145. OBRAS DE ACONDICIONAMIENTO;213;PUENTE DE VALLECAS;05;EDUCACIÓN;00;COLEGIOS;;;;;;;0,00;24.997,31;24.997,31;0,00;0,00;24.997,31;24.997,31;24.997,31;0,00;24.997,31
;;001;213;32101;63200;2014/000041;2014/150041;COLEGIO PÚBLICO VIRGEN DEL CERRO, C/ MOHERNANDO, 1. OBRAS DE CONSERVACIÓN;213;PUENTE DE VALLECAS;05;EDUCACIÓN;00;COLEGIOS;;;;;;;0,00;10.950,86;10.950,86;0,00;0,00;10.950,86;10.950,86;10.950,86;0,00;10.950,86
;;001;213;32101;63200;2014/000041;2014/160041;COLEGIO PÚBLICO ARAGÓN, AV. RAFAEL ALBERTI, 2. OBRAS DE CONSERVACIÓN;213;PUENTE DE VALLECAS;05;EDUCACIÓN;00;COLEGIOS;;;;;;;0,00;19.619,36;19.619,36;0,00;0,00;19.619,36;19.619,36;19.619,36;0,00;19.619,36
;;001;213;32101;63200;2014/000041;2014/170041;COLEGIO PÚBLICO ASTURIAS, C/ ASTURIANOS, 2. OBRAS DE ACONDICIONAMIENTO;213;PUENTE DE VALLECAS;05;EDUCACIÓN;00;COLEGIOS;;;;;;;0,00;56.181,10;56.181,10;0,00;0,00;56.181,10;56.181,10;56.181,10;0,00;56.181,10
;;001;213;32101;63200;2014/000041;2014/180041;CENTRO EDUCACIÓN ESPECIAL PUENTE DE VALLECAS, CRTA. VALENCIA KM. 7,4. REFORMA;213;PUENTE DE VALLECAS;05;EDUCACIÓN;02;CENTROS DE EDUCACIÓN ESPECIAL;;;;;;;0,00;98.211,50;98.211,50;0,00;0,00;98.211,50;98.211,50;98.211,50;0,00;98.211,50
;;001;213;32101;63200;2014/000041;2014/190041;COLEGIO PÚBLICO JOSÉ MARÍA DE PEREDA, C/ MESTANZA, 94. ACONDICIONAMIENTO;213;PUENTE DE VALLECAS;05;EDUCACIÓN;00;COLEGIOS;;;;;;;0,00;60.762,96;60.762,96;0,00;0,00;60.762,96;60.762,96;60.762,96;0,00;60.762,96
;;001;213;32101;63200;2014/000041;2014/200041;COLEGIO PÚBLICO FRANCISCO RUANO, C/ ALMURADIEL, 150. OBRAS DE CONSERVACIÓN;213;PUENTE DE VALLECAS;05;EDUCACIÓN;00;COLEGIOS;;;;;;;0,00;40.286,34;40.286,34;0,00;0,00;40.286,34;40.286,34;40.286,34;0,00;33.746,59
;;001;213;32101;63200;2014/000041;2014/210041;COLEGIO PÚBLICO FRANCISCO GINER DE LOS RÍOS, C/ MEMBEZAR, 25. CONSERVACIÓN;213;PUENTE DE VALLECAS;05;EDUCACIÓN;00;COLEGIOS;;;;;;;0,00;9.598,99;9.598,99;0,00;0,00;9.598,99;9.598,99;9.598,99;0,00;9.598,99
;;001;213;32101;63200;2014/000041;2014/220041;COLEGIO PÚBLICO SAN PABLO, C/ PEÑA MORRAZ, 1. OBRAS DE CONSERVACIÓN;213;PUENTE DE VALLECAS;05;EDUCACIÓN;00;COLEGIOS;;;;;;;0,00;44.300,83;44.300,83;0,00;0,00;44.300,83;44.300,83;44.300,83;0,00;44.300,83
;;001;213;32101;63200;2014/000041;2014/230041;COLEGIO PÚBLICO AMOS ACERO, C/ RODRÍGUEZ ESPINOSA, 54. ACONDICIONAMIENTO;213;PUENTE DE VALLECAS;05;EDUCACIÓN;00;COLEGIOS;;;;;;;0,00;32.043,00;32.043,00;0,00;0,00;32.043,00;32.043,00;32.043,00;0,00;28.823,17
;;001;213;32101;63200;2014/000041;2014/240041;COLEGIO PÚBLICO CONCHA ESPINA, C/ GERARDO DIEGO, 6. OBRAS DE REFORMA;213;PUENTE DE VALLECAS;05;EDUCACIÓN;00;COLEGIOS;;;;;;;0,00;49.349,10;49.349,10;0,00;0,00;49.349,10;49.349,10;49.349,10;0,00;49.349,10
;;001;213;32101;63200;2014/000041;2014/250041;ESCUELA INFANTIL EL CASERÍO, C/ MARÍA TERESA ROBLEDO, 3. OBRAS DE CONSERVACIÓN;213;PUENTE DE VALLECAS;05;EDUCACIÓN;01;ESCUELAS INFANTILES;;;;;;;0,00;9.122,41;9.122,41;0,00;0,00;9.122,41;9.122,41;9.122,41;0,00;9.122,41
;;001;213;32101;63200;2014/000041;2014/260041;COLEGIO PÚBLICO SANTO DOMINGO. OBRAS DE REFORMA COCINA;213;PUENTE DE VALLECAS;05;EDUCACIÓN;00;COLEGIOS;;;;;;;0,00;47.163,43;47.163,43;0,00;0,00;47.163,43;47.163,43;47.163,43;0,00;47.163,43
;;001;213;32101;63200;2014/000041;2014/270041;COLEGIO PÚBLICO CARLOS SÁINZ DE LOS TERREROS. ADECUACIÓN DE CUBIERTA;213;PUENTE DE VALLECAS;05;EDUCACIÓN;00;COLEGIOS;;;;;;;0,00;29.873,81;29.873,81;0,00;0,00;29.873,81;29.873,81;29.873,81;0,00;29.873,81
;;001;213;34101;63200;2014/000042;2014/000042;OBRAS CONSERVACIÓN INSTALACIONES DEPORTIVAS DISTRITO PUENTE DE VALLECAS;213;PUENTE DE VALLECAS;11;DEPORTES, JUVENTUD  Y ESPARCIMIENTO;01;POLIDEPORTIVOS;;;;;;;353.788,00;-353.787,33;0,67;0,67;0,00;0,00;0,00;0,00;0,00;0,00
;;001;213;34101;63200;2014/000042;2014/010042;CENTRO DEPORTIVO ALBERTO GARCÍA, C/ REGUERA DE TOMATEROS, 39. CONSERVACIÓN;213;PUENTE DE VALLECAS;11;DEPORTES, JUVENTUD  Y ESPARCIMIENTO;01;POLIDEPORTIVOS;;;;;;;0,00;86.840,92;86.840,92;0,00;0,00;86.840,92;86.840,92;86.840,92;0,00;86.840,92
;;001;213;34101;63200;2014/000042;2014/020042;CENTRO DEPORTIVO PUENTE DE VALLECAS, C/ PAYASO FOFÓ, 7. OBRAS DE CONSERVACIÓN;213;PUENTE DE VALLECAS;11;DEPORTES, JUVENTUD  Y ESPARCIMIENTO;01;POLIDEPORTIVOS;;;;;;;0,00;111.238,03;111.238,03;0,00;0,00;111.238,03;111.238,03;111.238,03;0,00;111.238,03
;;001;213;34101;63200;2014/000042;2014/030042;CENTRO DEPORTIVO ENTREVÍAS, C/ RONDA DEL SUR, 4. OBRAS DE CONSERVACIÓN;213;PUENTE DE VALLECAS;11;DEPORTES, JUVENTUD  Y ESPARCIMIENTO;01;POLIDEPORTIVOS;;;;;;;0,00;15.735,58;15.735,58;0,00;0,00;15.735,58;15.735,58;15.735,58;0,00;15.735,58
;;001;213;34101;63200;2014/000042;2014/040042;CENTRO DEPORTIVO PALOMERAS, C/ TRANVÍA DE ARGANDA S/N. OBRAS DE CONSERVACIÓN;213;PUENTE DE VALLECAS;11;DEPORTES, JUVENTUD  Y ESPARCIMIENTO;01;POLIDEPORTIVOS;;;;;;;0,00;58.099,10;58.099,10;0,00;0,00;58.099,10;58.099,10;58.099,10;0,00;58.099,10
;;001;213;34101;63200;2014/000042;2014/050042;DEPORTIVO BÁSICO RONDA DEL SUR, C/ RONDA DEL SUR, 231. OBRAS DE CONSERVACIÓN;213;PUENTE DE VALLECAS;11;DEPORTES, JUVENTUD  Y ESPARCIMIENTO;02;PISTAS DEPORTIVAS ELEMENTALES;;;;;;;0,00;20.460,30;20.460,30;0,00;0,00;20.460,30;20.460,30;20.460,30;0,00;20.460,30
;;001;213;34101;63200;2014/000042;2014/060042;DEPORTIVO BÁSICO LOS ARBOLITOS, C/ RONDA DEL SUR S/N. OBRAS DE CONSERVACIÓN;213;PUENTE DE VALLECAS;11;DEPORTES, JUVENTUD  Y ESPARCIMIENTO;02;PISTAS DEPORTIVAS ELEMENTALES;;;;;;;0,00;21.422,84;21.422,84;0,00;0,00;21.422,84;21.422,84;21.422,84;0,00;21.422,84
;;001;213;34101;63200;2014/000042;2014/070042;DEPORTIVO BÁSICO PARQUE MARCHAMALO. OBRAS DE CONSERVACIÓN;213;PUENTE DE VALLECAS;11;DEPORTES, JUVENTUD  Y ESPARCIMIENTO;02;PISTAS DEPORTIVAS ELEMENTALES;;;;;;;0,00;288,42;288,42;0,00;0,00;288,42;288,42;288,42;0,00;0,00
;;001;213;34101;63200;2014/000042;2014/080042;DEPORTIVO BÁSICO LUIS BUÑUEL. OBRAS DE CONSERVACIÓN;213;PUENTE DE VALLECAS;11;DEPORTES, JUVENTUD  Y ESPARCIMIENTO;02;PISTAS DEPORTIVAS ELEMENTALES;;;;;;;0,00;8.367,52;8.367,52;0,00;0,00;8.367,52;8.367,52;8.367,52;0,00;0,00
;;001;213;34101;63200;2014/000042;2014/090042;DEPORTIVO BÁSICO PARQUE LA VIÑA. OBRAS DE CONSERVACIÓN;213;PUENTE DE VALLECAS;11;DEPORTES, JUVENTUD  Y ESPARCIMIENTO;02;PISTAS DEPORTIVAS ELEMENTALES;;;;;;;0,00;3.654,19;3.654,19;0,00;0,00;3.654,19;3.654,19;3.654,19;0,00;0,00
;;001;213;34101;63200;2014/000042;2014/100042;DEPORTIVO BÁSICO MIGUEL HERNÁNDEZ. OBRAS DE CONSERVACIÓN;213;PUENTE DE VALLECAS;11;DEPORTES, JUVENTUD  Y ESPARCIMIENTO;02;PISTAS DEPORTIVAS ELEMENTALES;;;;;;;0,00;1.746,61;1.746,61;0,00;0,00;1.746,61;1.746,61;1.746,61;0,00;0,00
;;001;213;34101;63200;2014/000042;2014/110042;DEPORTIVO BÁSICO HERMANOS TRUEBA. OBRAS DE CONSERVACIÓN;213;PUENTE DE VALLECAS;11;DEPORTES, JUVENTUD  Y ESPARCIMIENTO;02;PISTAS DEPORTIVAS ELEMENTALES;;;;;;;0,00;455,70;455,70;0,00;0,00;455,70;455,70;455,70;0,00;0,00
;;001;213;34101;63200;2014/000042;2014/120042;DEPORTIVO BÁSICO FRANCISCO LAGUNA. OBRAS DE CONSERVACIÓN;213;PUENTE DE VALLECAS;11;DEPORTES, JUVENTUD  Y ESPARCIMIENTO;02;PISTAS DEPORTIVAS ELEMENTALES;;;;;;;0,00;9.614,84;9.614,84;0,00;0,00;9.614,84;9.614,84;9.614,84;0,00;0,00
;;001;213;34101;63200;2014/000042;2014/130042;DEPORTIVO BÁSICO COLONIA SIERRA DEL VALLE. OBRAS DE CONSERVACIÓN;213;PUENTE DE VALLECAS;11;DEPORTES, JUVENTUD  Y ESPARCIMIENTO;02;PISTAS DEPORTIVAS ELEMENTALES;;;;;;;0,00;798,81;798,81;0,00;0,00;798,81;798,81;798,81;0,00;0,00
;;001;213;34101;63200;2014/000042;2014/140042;DEPORTIVO BÁSICO COLONIA DE LOS TAXISTAS. OBRAS DE CONSERVACIÓN;213;PUENTE DE VALLECAS;11;DEPORTES, JUVENTUD  Y ESPARCIMIENTO;02;PISTAS DEPORTIVAS ELEMENTALES;;;;;;;0,00;13.736,41;13.736,41;0,00;0,00;13.736,41;13.736,41;13.736,41;0,00;0,00
;;001;213;34101;63200;2014/000042;2014/150042;DEPORTIVO BÁSICO JESÚS DIVINO OBRERO. OBRAS DE CONSERVACIÓN;213;PUENTE DE VALLECAS;11;DEPORTES, JUVENTUD  Y ESPARCIMIENTO;02;PISTAS DEPORTIVAS ELEMENTALES;;;;;;;0,00;144,21;144,21;0,00;0,00;144,21;144,21;144,21;0,00;0,00
;;001;213;34101;63200;2014/000042;2014/160042;DEPORTIVO BÁSICO ANDÉVALO. OBRAS DE CONSERVACIÓN;213;PUENTE DE VALLECAS;11;DEPORTES, JUVENTUD  Y ESPARCIMIENTO;02;PISTAS DEPORTIVAS ELEMENTALES;;;;;;;0,00;985,93;985,93;0,00;0,00;985,93;985,93;985,93;0,00;0,00
;;001;213;34101;63200;2014/000042;2014/170042;DEPORTIVO BÁSICO SAN ANSELMO. OBRAS DE CONSERVACIÓN;213;PUENTE DE VALLECAS;11;DEPORTES, JUVENTUD  Y ESPARCIMIENTO;02;PISTAS DEPORTIVAS ELEMENTALES;;;;;;;0,00;197,92;197,92;0,00;0,00;197,92;197,92;197,92;0,00;0,00
;;001;213;34101;63599;2014/000296;2014/000296;EQUIPAMIENTO POLIDEPORTIVOS DEL  DISTRITO PUENTE DE VALLECAS;213;PUENTE DE VALLECAS;11;DEPORTES, JUVENTUD  Y ESPARCIMIENTO;01;POLIDEPORTIVOS;;;;;;;0,00;4.099,81;4.099,81;4.099,81;0,00;0,00;0,00;0,00;0,00;0,00
;;001;213;34101;63599;2014/000296;2014/010296;EQUIPAMIENTO CENTRO DEPORTIVO PALOMERAS, C/ TRANVÍA DE ARGANDA, 4;213;PUENTE DE VALLECAS;11;DEPORTES, JUVENTUD  Y ESPARCIMIENTO;01;POLIDEPORTIVOS;;;;;;;0,00;18.900,19;18.900,19;0,00;0,00;18.900,19;18.900,19;18.900,19;0,00;2.306,80
;;001;213;34101;63600;2014/000296;2014/000296;EQUIPAMIENTO POLIDEPORTIVOS DEL  DISTRITO PUENTE DE VALLECAS;213;PUENTE DE VALLECAS;11;DEPORTES, JUVENTUD  Y ESPARCIMIENTO;01;POLIDEPORTIVOS;;;;;;;0,00;170,48;170,48;170,48;0,00;0,00;0,00;0,00;0,00;0,00
;;001;213;34101;63600;2014/000296;2014/010296;EQUIPAMIENTO CENTRO DEPORTIVO PALOMERAS, C/ TRANVÍA DE ARGANDA, 4;213;PUENTE DE VALLECAS;11;DEPORTES, JUVENTUD  Y ESPARCIMIENTO;01;POLIDEPORTIVOS;;;;;;;0,00;1.829,52;1.829,52;0,00;0,00;1.829,52;1.829,52;1.829,52;0,00;1.829,52
;;001;213;93302;63200;2014/000040;2014/000040;OBRAS CONSERVACIÓN EDIFICIOS DISTRITO PUENTE DE VALLECAS;213;PUENTE DE VALLECAS;00;INVERSIONES DE CARÁCTER GENERAL;03;EDIFICIOS PARA EL USO GENERAL;;;;;;;338.702,00;-338.701,01;0,99;0,99;0,00;0,00;0,00;0,00;0,00;0,00
;;001;213;93302;63200;2014/000040;2014/010040;CENTRO CULTURAL ALBERTO SÁNCHEZ, C/ RISCO DE PELOCHE, 14. OBRAS DE CONSERVACIÓN;213;PUENTE DE VALLECAS;10;CULTURA;03;CENTROS CULTURALES;;;;;;;0,00;1.450,72;1.450,72;0,00;0,00;1.450,72;1.450,72;1.450,72;0,00;1.450,72
;;001;213;93302;63200;2014/000040;2014/020040;CENTRO CULTURAL TALLERES DE CREATIVIDAD, C/ SIERRA CARBONERA, 74. CONSERVACIÓN;213;PUENTE DE VALLECAS;10;CULTURA;03;CENTROS CULTURALES;;;;;;;0,00;12.236,63;12.236,63;0,00;0,00;12.236,63;12.236,63;12.236,63;0,00;12.236,63
;;001;213;93302;63200;2014/000040;2014/030040;CENTRO SERVICIOS SOCIALES ENTREVÍAS, C/ YUSTE, 8. OBRAS DE CONSERVACIÓN;213;PUENTE DE VALLECAS;03;PROTECCIÓN Y PROMOCIÓN SOCIAL;02;CENTROS DE SERVICIOS SOCIALES;;;;;;;0,00;33.877,41;33.877,41;0,00;0,00;33.877,41;33.877,41;33.877,41;0,00;33.877,41
;;001;213;93302;63200;2014/000040;2014/040040;CENTRO SERVICIOS SOCIALES RAMÓN PÉREZ AYALA, C/ MARISMAS, 24. CONSERVACIÓN;213;PUENTE DE VALLECAS;03;PROTECCIÓN Y PROMOCIÓN SOCIAL;02;CENTROS DE SERVICIOS SOCIALES;;;;;;;0,00;30.447,03;30.447,03;0,00;0,00;30.447,03;30.447,03;30.447,03;0,00;30.447,03
;;001;213;93302;63200;2014/000040;2014/050040;AUDITORIO ENTREVÍAS, C/ RONDA DEL SUR S/N. OBRAS DE ACONDICIONAMIENTO;213;PUENTE DE VALLECAS;10;CULTURA;04;OTROS CENTROS PARA MANIFESTACIONES CULTURALES;;;;;;;0,00;29.913,34;29.913,34;0,00;0,00;29.913,34;29.913,34;29.913,34;0,00;29.913,34
;;001;213;93302;63200;2014/000040;2014/060040;CENTRO SERVICIOS SOCIALES CASA DEL BULEVAR, C/ PEÑA GORBEA, 22. CONSERVACIÓN;213;PUENTE DE VALLECAS;03;PROTECCIÓN Y PROMOCIÓN SOCIAL;02;CENTROS DE SERVICIOS SOCIALES;;;;;;;0,00;106.651,66;106.651,66;0,00;0,00;106.651,66;106.651,66;106.651,66;0,00;106.651,66
;;001;213;93302;63200;2014/000040;2014/070040;CENTRO DE MAYORES SAN DIEGO, C/ JAVIER DE MIGUEL, 10. OBRAS DE CONSERVACIÓN;213;PUENTE DE VALLECAS;03;PROTECCIÓN Y PROMOCIÓN SOCIAL;01;CENTROS DE MAYORES;;;;;;;0,00;13.886,61;13.886,61;0,00;0,00;13.886,61;13.886,61;13.886,61;0,00;13.886,61
;;001;213;93302;63200;2014/000040;2014/080040;CENTRO DE MAYORES PABLO NERUDA. OBRAS DE ACONDICIONAMIENTO;213;PUENTE DE VALLECAS;03;PROTECCIÓN Y PROMOCIÓN SOCIAL;01;CENTROS DE MAYORES;;;;;;;0,00;63.832,74;63.832,74;0,00;0,00;63.832,74;63.832,74;63.832,74;0,00;63.832,74
;;001;213;93302;63200;2014/000040;2014/090040;BIBLIOTECA PÚBLICA VALLECAS. OBRAS DE CONSERVACIÓN;213;PUENTE DE VALLECAS;10;CULTURA;00;BIBLIOTECAS Y PATRIMONIO BIBLIOGRÁFICO;;;;;;;0,00;3.614,48;3.614,48;0,00;0,00;3.614,48;3.614,48;3.614,48;0,00;3.614,48
;;001;213;93302;63200;2014/000040;2014/100040;CENTRO DE MAYORES ALTO DEL ARENAL. OBRAS DE CONSERVACIÓN;213;PUENTE DE VALLECAS;03;PROTECCIÓN Y PROMOCIÓN SOCIAL;01;CENTROS DE MAYORES;;;;;;;0,00;13.992,15;13.992,15;0,00;0,00;13.992,15;13.992,15;13.992,15;0,00;13.992,15
;;001;213;93302;63200;2014/000040;2014/110040;EDIFICIO SEDE DISTRITO PUENTE DE VALLECAS. OBRAS DE ACONDICIONAMIENTO;213;PUENTE DE VALLECAS;00;INVERSIONES DE CARÁCTER GENERAL;02;SERVICIOS ADMINISTRATIVOS  TERRITORIALES;;;;;;;0,00;52.724,25;52.724,25;0,00;0,00;52.724,25;52.724,25;52.724,25;0,00;52.724,25
;;001;213;93302;63200;2014/007089;2014/007089;IFS-CENTRO SERVICIOS SOCIALES RAMÓN PÉREZ DE AYALA. ACONDICIONAMIENTO PRIMERA PLANTA;213;PUENTE DE VALLECAS;03;PROTECCIÓN Y PROMOCIÓN SOCIAL;02;CENTROS DE SERVICIOS SOCIALES;16;INV.FINANCIERAM. SOSTENIBLE;;;;;0,00;171.621,54;171.621,54;0,00;0,00;171.621,54;171.621,54;171.621,54;0,00;0,00
;;001;213;93302;63200;2014/007090;2014/007090;IFS-BIBLIOTECA PUENTE DE VALLECAS. INSTALACIÓN BOMBAS DE CALOR;213;PUENTE DE VALLECAS;10;CULTURA;00;BIBLIOTECAS Y PATRIMONIO BIBLIOGRÁFICO;16;INV.FINANCIERAM. SOSTENIBLE;;;;;0,00;35.739,04;35.739,04;0,06;0,00;35.738,98;35.738,98;35.738,98;0,00;35.738,98
;;001;213;93302;63200;2014/007091;2014/007091;IFS-CENTRO CULTURAL ALBERTO SÁNCHEZ. INSTALACIÓN EQUIPOS DE AIRE ACONDICIONADO;213;PUENTE DE VALLECAS;10;CULTURA;03;CENTROS CULTURALES;16;INV.FINANCIERAM. SOSTENIBLE;;;;;0,00;49.489,97;49.489,97;0,00;0,00;49.489,97;49.489,97;49.489,97;0,00;49.489,97
;;001;213;93302;63200;2014/007092;2014/007092;IFS-CENTRO CULTURAL TALLERES DE CREATIVIDAD. INSTALACIÓN BOMBA DE CALOR;213;PUENTE DE VALLECAS;10;CULTURA;03;CENTROS CULTURALES;16;INV.FINANCIERAM. SOSTENIBLE;;;;;0,00;3.213,98;3.213,98;0,01;0,00;3.213,97;3.213,97;3.213,97;0,00;3.213,97
;;001;213;93302;63200;2014/007093;2014/007093;IFS-CENTRO DE MAYORES ALTO DEL ARENAL. MEJORA DE LA ACCESIBILIDAD;213;PUENTE DE VALLECAS;03;PROTECCIÓN Y PROMOCIÓN SOCIAL;01;CENTROS DE MAYORES;16;INV.FINANCIERAM. SOSTENIBLE;;;;;0,00;9.601,25;9.601,25;0,00;0,00;9.601,25;9.601,25;9.601,25;0,00;9.601,25
;;001;213;93302;63200;2014/007094;2014/007094;IFS-CENTRO CULTURAL EL POZO. OBRAS DE ACONDICIONAMIENTO;213;PUENTE DE VALLECAS;10;CULTURA;03;CENTROS CULTURALES;16;INV.FINANCIERAM. SOSTENIBLE;;;;;0,00;65.502,37;65.502,37;0,00;0,00;65.502,37;65.502,37;65.502,37;0,00;65.502,37
;;001;213;93302;63200;2014/007095;2014/007095;IFS-CENTRO DE MAYORES CASA DEL BULEVAR. OBRAS DE ACONDICIONAMIENTO;213;PUENTE DE VALLECAS;03;PROTECCIÓN Y PROMOCIÓN SOCIAL;01;CENTROS DE MAYORES;16;INV.FINANCIERAM. SOSTENIBLE;;;;;0,00;67.984,39;67.984,39;0,01;0,00;67.984,38;67.984,38;67.984,38;0,00;67.984,38
;;001;213;93302;63200;2014/007096;2014/007096;IFS-CENTRO DE MAYORES SAN DIEGO. ACONDICIONAMIENTO TERRAZA EXTERIOR Y FACHADAS;213;PUENTE DE VALLECAS;03;PROTECCIÓN Y PROMOCIÓN SOCIAL;01;CENTROS DE MAYORES;16;INV.FINANCIERAM. SOSTENIBLE;;;;;0,00;143.440,46;143.440,46;0,05;0,00;143.440,41;143.440,41;143.440,41;0,00;143.440,41
;;001;213;93302;63200;2014/007097;2014/007097;IFS-CENTRO MAYORES PABLO NERUDA.SISTEMAS PROTECCIÓN CONTRA INCENDIOS Y CLIMATIZACIÓN;213;PUENTE DE VALLECAS;03;PROTECCIÓN Y PROMOCIÓN SOCIAL;01;CENTROS DE MAYORES;16;INV.FINANCIERAM. SOSTENIBLE;;;;;0,00;92.711,93;92.711,93;0,01;0,00;92.711,92;92.711,92;92.711,92;0,00;0,00
;;001;213;93302;63200;2014/007098;2014/007098;IFS-CENTRO DE MAYORES ENTREVÍAS. OBRAS DE ACCESIBILIDAD Y CLIMATIZACIÓN;213;PUENTE DE VALLECAS;03;PROTECCIÓN Y PROMOCIÓN SOCIAL;01;CENTROS DE MAYORES;16;INV.FINANCIERAM. SOSTENIBLE;;;;;0,00;72.650,99;72.650,99;0,00;0,00;72.650,99;72.650,99;72.650,99;0,00;0,00
;;001;214;32101;63200;2014/000044;2014/000044;OBRAS CONSERVACIÓN COLEGIOS Y OTROS CENTROS EDUCATIVOS DISTRITO MORATALAZ;214;MORATALAZ;05;EDUCACIÓN;00;COLEGIOS;;;;;;;309.449,00;-309.377,28;71,72;71,72;0,00;0,00;0,00;0,00;0,00;0,00
;;001;214;32101;63200;2014/000044;2014/010044;COLEGIO PÚBLICO FRANCISCO DE LUIS. OBRAS DE CONSERVACIÓN;214;MORATALAZ;05;EDUCACIÓN;00;COLEGIOS;;;;;;;0,00;58.636,51;58.636,51;0,00;0,00;58.636,51;58.636,51;58.636,51;0,00;58.636,51
;;001;214;32101;63200;2014/000044;2014/020044;COLEGIO PÚBLICO PÍO BAROJA, C/ LUIS DE HOYOS SAINZ, 84. OBRAS DE CONSERVACIÓN;214;MORATALAZ;05;EDUCACIÓN;00;COLEGIOS;;;;;;;0,00;23.760,27;23.760,27;0,00;0,00;23.760,27;23.760,27;23.760,27;0,00;20.115,62
;;001;214;32101;63200;2014/000044;2014/030044;COLEGIO PÚBLICO FONTARRÓN, C/ ARROYO FONTARRÓN, 24. OBRAS DE CONSERVACIÓN;214;MORATALAZ;05;EDUCACIÓN;00;COLEGIOS;;;;;;;0,00;28.763,78;28.763,78;0,00;0,00;28.763,78;28.763,78;28.763,78;0,00;28.763,78
;;001;214;32101;63200;2014/000044;2014/040044;COLEGIO PÚBLICO MANUEL SAINZ DE VICUÑA. MEJORAS BIBLIOTECA;214;MORATALAZ;05;EDUCACIÓN;00;COLEGIOS;;;;;;;0,00;40.913,04;40.913,04;0,00;0,00;40.913,04;40.913,04;40.913,04;0,00;40.913,04
;;001;214;32101;63200;2014/000044;2014/050044;COLEGIO PÚBLICO PADRE VITORIA, C/ HACIENDA DE PAVONES, 328. CONSERVACIÓN;214;MORATALAZ;05;EDUCACIÓN;00;COLEGIOS;;;;;;;0,00;13.041,99;13.041,99;0,00;0,00;13.041,99;13.041,99;13.041,99;0,00;13.041,99
;;001;214;32101;63200;2014/000044;2014/060044;ESCUELA INFANTIL EL LIRÓN, C/ PICO DE LOS ARTILLEROS, 123. OBRAS DE CONSERVACIÓN;214;MORATALAZ;05;EDUCACIÓN;01;ESCUELAS INFANTILES;;;;;;;0,00;2.207,83;2.207,83;0,00;0,00;2.207,83;2.207,83;2.207,83;0,00;2.207,83
;;001;214;32101;63200;2014/000044;2014/070044;COLEGIO PÚBLICO DOCTOR CONDE DE ARRUGA. OBRAS DE CONSERVACIÓN;214;MORATALAZ;05;EDUCACIÓN;00;COLEGIOS;;;;;;;0,00;9.794,43;9.794,43;0,00;0,00;9.794,43;9.794,43;9.794,43;0,00;9.794,43
;;001;215;32101;63200;2014/000047;2014/010047;COLEGIO PÚBLICO CONDE DE ROMANONES, C/ ELFO, 143. OBRAS DE CONSERVACIÓN;215;CIUDAD LINEAL;05;EDUCACIÓN;00;COLEGIOS;;;;;;;0,00;608,87;608,87;0,00;0,00;608,87;608,87;608,87;0,00;608,87
;;001;215;32101;63200;2014/000047;2014/020047;COLEGIO PÚBLICO SAN BENITO. OBRAS DE CONSERVACIÓN;215;CIUDAD LINEAL;05;EDUCACIÓN;00;COLEGIOS;;;;;;;0,00;970,26;970,26;0,00;0,00;970,26;970,26;970,25;0,00;307,76
;;001;215;32101;63200;2014/000047;2014/030047;COLEGIO PÚBLICO MÉJICO, AV. BADAJOZ, 74. OBRAS DE ACONDICIONAMIENTO;215;CIUDAD LINEAL;05;EDUCACIÓN;00;COLEGIOS;;;;;;;0,00;55.545,76;55.545,76;0,00;0,00;55.545,76;55.545,76;55.545,76;0,00;41.525,60
;;001;215;32101;63200;2014/000047;2014/040047;COLEGIO PÚBLICO GANDHI, C/ GANDHI, 10. OBRAS DE CONSERVACIÓN;215;CIUDAD LINEAL;05;EDUCACIÓN;00;COLEGIOS;;;;;;;0,00;14.298,13;14.298,13;0,00;0,00;14.298,13;14.298,13;14.298,13;0,00;14.298,13
;;001;215;32101;63200;2014/000047;2014/050047;COLEGIO PÚBLICO BLASCO VILATELA. REFORMA ASEOS;215;CIUDAD LINEAL;05;EDUCACIÓN;00;COLEGIOS;;;;;;;0,00;44.243,84;44.243,84;0,00;0,00;44.243,84;44.243,84;41.889,90;0,00;14.526,67
;;001;215;32101;63200;2014/000047;2014/060047;COLEGIO PÚBLICO JOAQUÍN TURINA. REFORMA DE GIMNASIO;215;CIUDAD LINEAL;05;EDUCACIÓN;00;COLEGIOS;;;;;;;0,00;26.304,54;26.304,54;0,00;0,00;26.304,54;26.304,54;26.304,54;0,00;26.304,54
;;001;215;32101;63200;2014/000047;2014/070047;CENTRO EDUCACIÓN ESPECIAL INFANTA ELENA. OBRAS DE CONSERVACIÓN;215;CIUDAD LINEAL;05;EDUCACIÓN;02;CENTROS DE EDUCACIÓN ESPECIAL;;;;;;;0,00;10.679,60;10.679,60;0,00;0,00;10.679,60;10.679,60;10.679,60;0,00;37,35
;;001;215;32101;63200;2014/000047;2014/080047;COLEGIO PÚBLICO LEOPOLDO ALAS. OBRAS DE CONSERVACIÓN;215;CIUDAD LINEAL;05;EDUCACIÓN;00;COLEGIOS;;;;;;;0,00;472,46;472,46;0,00;0,00;472,46;472,46;472,46;0,00;472,46
;;001;215;32101;63200;2014/000047;2014/090047;COLEGIO PÚBLICO MÉJICO. OBRAS DE CONSERVACIÓN;215;CIUDAD LINEAL;05;EDUCACIÓN;00;COLEGIOS;;;;;;;0,00;611,81;611,81;0,00;0,00;611,81;611,81;611,81;0,00;611,81
;;001;215;32101;63200;2014/000047;2014/100047;COLEGIO PÚBLICO MIGUEL BLASCO VILATELA. OBRAS DE CONSERVACIÓN;215;CIUDAD LINEAL;05;EDUCACIÓN;00;COLEGIOS;;;;;;;0,00;140,53;140,53;0,00;0,00;140,53;140,53;140,53;0,00;25,11
;;001;215;32101;63200;2014/000047;2014/110047;COLEGIO PÚBLICO NUESTRA SEÑORA DE LA CONCEPCIÓN. OBRAS DE CONSERVACIÓN;215;CIUDAD LINEAL;05;EDUCACIÓN;00;COLEGIOS;;;;;;;0,00;514,01;514,01;0,00;0,00;514,01;514,01;514,01;0,00;514,01
;;001;215;32101;63200;2014/000047;2014/120047;COLEGIO PÚBLICO SAN JUAN BAUTISTA. OBRAS DE CONSERVACIÓN;215;CIUDAD LINEAL;05;EDUCACIÓN;00;COLEGIOS;;;;;;;0,00;41,52;41,52;0,00;0,00;41,52;41,52;41,52;0,00;41,52
;;001;215;32101;63200;2014/000047;2014/130047;COLEGIO PÚBLICO SAN JUAN BOSCO. OBRAS DE CONSERVACIÓN;215;CIUDAD LINEAL;05;EDUCACIÓN;00;COLEGIOS;;;;;;;0,00;927,52;927,52;0,00;0,00;927,52;927,52;927,52;0,00;31,78
;;001;215;32101;63200;2014/000047;2014/140047;COLEGIO PÚBLICO GUSTAVO ADOLFO BÉCQUER, C/ SANTA GENOVEVA, 32. CONSERVACIÓN;215;CIUDAD LINEAL;05;EDUCACIÓN;00;COLEGIOS;;;;;;;0,00;2.354,66;2.354,66;0,00;0,00;2.354,66;2.354,66;2.354,66;0,00;0,00
